{
  "schema_version": "0.1",
  "generated_at": "2026-07-02T15:08:00Z",
  "evidence_type": "manual_verified",
  "safe_to_commit": true,
  "contains_secret_values": false,
  "repository": "adamallcock/runcost",
  "workflow": ".github/workflows/release.yml",
  "environment": "release",
  "pypi": {
    "package": "runcost-ai",
    "registry": "pypi",
    "trusted_publisher_configured": true,
    "provenance_or_oidc_configured": true,
    "stored_registry_token_required": false,
    "configured_by": "GitHub Actions release workflow",
    "verified_at": "2026-07-02T15:07:18Z",
    "verification_method": "Successful PyPI publish step in release workflow plus live PyPI version check",
    "evidence_url": "https://github.com/adamallcock/runcost/actions/runs/28600349626"
  },
  "npm": {
    "package": "runcost",
    "registry": "npm",
    "trusted_publisher_configured": true,
    "provenance_or_oidc_configured": true,
    "stored_registry_token_required": false,
    "configured_by": "GitHub Actions release workflow",
    "verified_at": "2026-07-02T15:07:22Z",
    "verification_method": "Successful npm publish step in release workflow plus live npm provenance attestation check",
    "evidence_url": "https://registry.npmjs.org/-/npm/v1/attestations/runcost@0.1.11"
  },
  "notes": [
    "This artifact records sanitized registry-side verification after the v0.1.11 publish workflow.",
    "No registry credentials, account identifiers, or private registry settings are included."
  ]
}
